{
  "kind": "iosram_btm",
  "size": 4,
  "io_input": false,
  "io_output": true,
  "custom_properties": [
    {
      "name": "SRAM_ADDR_WIDTH",
      "value": 6
    }
  ],
  "required_parameters": [
    "IO_DATA_WIDTH",
    "IO_ADDR_WIDTH",
    "RESOURCE_INSTR_WIDTH",
    "BULK_BITWIDTH",
    "WORD_BITWIDTH",
    "NUM_SLOTS",
    "FSM_PER_SLOT",
    "INSTR_OPCODE_BITWIDTH"
  ]
}
